Extracted contents:
header:          00 ff ff ff ff ff ff 00
serial number:   30 e4 8f 03 00 00 00 00 00 16
version:         01 03
basic params:    80 22 13 78 0a
chroma info:     a9 25 96 58 57 8e 28 1f 50 54
established:     00 00 00
standard:        01 01 01 01 01 01 01 01 01 01 01 01 01 01 01 01
descriptor 1:    58 1b 56 7e 50 00 0e 30 24 30 35 00 58 c2 10 00 00 19
descriptor 2:    00 00 00 00 00 00 00 00 00 00 00 00 00 00 00 00 00 00
descriptor 3:    00 00 00 fe 00 4c 47 20 44 69 73 70 6c 61 79 0a 20 20
descriptor 4:    00 00 00 fe 00 4c 50 31 34 30 57 48 34 2d 54 4c 4e 31
extensions:      00
checksum:        b3

Manufacturer: LGD Model 38f Serial Number 0
Made week 0 of 2012
EDID version: 1.3
Digital display
Maximum image size: 34 cm x 19 cm
Gamma: 2.20
Supported color formats: RGB 4:4:4, YCrCb 4:2:2
First detailed timing is preferred timing
Chroma Info:
Red X: 0.587891 Y: 0.345703
Green X: 0.341797 Y: 0.555664
Blue X: 0.156250 Y: 0.123047
White X: 0.313477 Y: 0.329102
Established timings supported:
Standard timings supported:
Detailed mode: Clock 70.000 MHz, 344 mm x 194 mm
               1366 1402 1450 1492 hborder 0
                768  771  776  782 vborder 0
               -hsync -vsync 
Manufacturer-specified data, tag 0
ASCII string: LG
ASCII string: LP140WH4
Checksum: 0xb3 (valid)
EDID block does NOT conform to EDID 1.3!
	Missing name descriptor
	Missing monitor ranges
	Detailed block string not properly terminated
